cluster	gloss
0	make a compound react with water and undergo hydrolysis
1	make a compound react with water and undergo hydrolysis
2	a measured amount of a solution of unknown concentration is added to a known volume of a second solution until the reaction between them is just complete; the concentration of the unknown solution (the titer) can then be calculated / make a compound react with water and undergo hydrolysis
3	a measured amount of a solution of unknown concentration is added to a known volume of a second solution until the reaction between them is just complete; the concentration of the unknown solution (the titer) can then be calculated / combine so as to form a whole; mix / make a compound react with water and undergo hydrolysis
4	fail to agree with; be in violation of; as of rules or patterns / go against / in direct opposition; directly
5	combined with extraneous elements / consisting of two or more substances or ingredients or elements or parts / include or contain; have as a component
6	an abnormal adhesion of two or more structures / closely and firmly integrated / come or be in close contact with; stick or hold together and resist separation
7	an additional ingredient that is added by mixing with the base / combine so as to form a whole; mix / incorporate a food ingredient into a mixture by repeatedly turning it over without stirring or beating
