cluster	gloss
0	(military) an offensive against an enemy (using weapons)
1	a sudden severe instance of abnormal heart function
2	a deliberate discourteous act (usually as an expression of anger or disapproval)
3	(of animals) epidemic among animals of a single kind within a particular region
4	(military) an offensive against an enemy (using weapons)
5	a sudden recurrence or worsening of symptoms
6	(usually plural) the state of having reflex spasms of the diaphragm accompanied by a rapid closure of the glottis producing an audible sound; sometimes a symptom of indigestion
7	a major depressive episode that occurs without the manic phase that occurs in the classic form of bipolar disorder
8	a sudden loss of consciousness resulting when the rupture or occlusion of a blood vessel leads to oxygen lack in the brain
